{
  "eidolon": "forge",
  "version": "1.4.0",
  "methodology": "FORGE",
  "installed_at": "2026-05-25T00:00:00Z",
  "target": "./.eidolons/forge",
  "spec_file": ".eidolons/forge/SPEC.md",
  "hosts_wired": [
    "claude-code",
    "copilot",
    "cursor",
    "opencode",
    "codex"
  ],
  "files_written": [
    {
      "path": ".eidolons/forge/SPEC.md",
      "sha256": "0000000000000000000000000000000000000000000000000000000000000000",
      "role": "spec",
      "mode": "created"
    },
    {
      "path": ".eidolons/forge/SKILL.md",
      "sha256": "0000000000000000000000000000000000000000000000000000000000000000",
      "role": "skill",
      "mode": "created"
    },
    {
      "path": ".eidolons/forge/agent.md",
      "sha256": "0000000000000000000000000000000000000000000000000000000000000000",
      "role": "entry-point",
      "mode": "created"
    },
    {
      "path": ".eidolons/forge/CLAUDE.md",
      "sha256": "0000000000000000000000000000000000000000000000000000000000000000",
      "role": "entry-point",
      "mode": "created"
    },
    {
      "path": ".eidolons/forge/DESIGN-RATIONALE.md",
      "sha256": "0000000000000000000000000000000000000000000000000000000000000000",
      "role": "other",
      "mode": "created"
    },
    {
      "path": ".eidolons/forge/README.md",
      "sha256": "0000000000000000000000000000000000000000000000000000000000000000",
      "role": "other",
      "mode": "created"
    },
    {
      "path": ".eidolons/forge/skills/framing.md",
      "sha256": "0000000000000000000000000000000000000000000000000000000000000000",
      "role": "skill",
      "mode": "created"
    },
    {
      "path": ".claude/skills/forge-framing/SKILL.md",
      "sha256": "0000000000000000000000000000000000000000000000000000000000000000",
      "role": "skill",
      "mode": "created"
    },
    {
      "path": ".eidolons/forge/skills/deliberation.md",
      "sha256": "0000000000000000000000000000000000000000000000000000000000000000",
      "role": "skill",
      "mode": "created"
    },
    {
      "path": ".claude/skills/forge-deliberation/SKILL.md",
      "sha256": "0000000000000000000000000000000000000000000000000000000000000000",
      "role": "skill",
      "mode": "created"
    },
    {
      "path": ".eidolons/forge/skills/verification.md",
      "sha256": "0000000000000000000000000000000000000000000000000000000000000000",
      "role": "skill",
      "mode": "created"
    },
    {
      "path": ".claude/skills/forge-verification/SKILL.md",
      "sha256": "0000000000000000000000000000000000000000000000000000000000000000",
      "role": "skill",
      "mode": "created"
    },
    {
      "path": ".eidolons/forge/templates/verdict.md",
      "sha256": "0000000000000000000000000000000000000000000000000000000000000000",
      "role": "template",
      "mode": "created"
    },
    {
      "path": ".eidolons/forge/templates/trade-off-analysis.md",
      "sha256": "0000000000000000000000000000000000000000000000000000000000000000",
      "role": "template",
      "mode": "created"
    },
    {
      "path": ".eidolons/forge/templates/feasibility-assessment.md",
      "sha256": "0000000000000000000000000000000000000000000000000000000000000000",
      "role": "template",
      "mode": "created"
    },
    {
      "path": ".eidolons/forge/templates/root-cause-analysis.md",
      "sha256": "0000000000000000000000000000000000000000000000000000000000000000",
      "role": "template",
      "mode": "created"
    },
    {
      "path": ".eidolons/forge/templates/conflict-resolution.md",
      "sha256": "0000000000000000000000000000000000000000000000000000000000000000",
      "role": "template",
      "mode": "created"
    },
    {
      "path": ".claude/agents/forge.md",
      "sha256": "0000000000000000000000000000000000000000000000000000000000000000",
      "role": "dispatch",
      "mode": "created"
    },
    {
      "path": "CLAUDE.md",
      "sha256": "0000000000000000000000000000000000000000000000000000000000000000",
      "role": "dispatch",
      "mode": "created"
    },
    {
      "path": ".github/instructions/forge.instructions.md",
      "sha256": "0000000000000000000000000000000000000000000000000000000000000000",
      "role": "dispatch",
      "mode": "created"
    },
    {
      "path": ".github/copilot-instructions.md",
      "sha256": "0000000000000000000000000000000000000000000000000000000000000000",
      "role": "dispatch",
      "mode": "created"
    },
    {
      "path": ".cursor/rules/forge.mdc",
      "sha256": "0000000000000000000000000000000000000000000000000000000000000000",
      "role": "dispatch",
      "mode": "created"
    },
    {
      "path": ".opencode/agents/forge.md",
      "sha256": "0000000000000000000000000000000000000000000000000000000000000000",
      "role": "dispatch",
      "mode": "created"
    },
    {
      "path": ".codex/agents/forge.md",
      "sha256": "0000000000000000000000000000000000000000000000000000000000000000",
      "role": "dispatch",
      "mode": "created"
    },
    {
      "path": "AGENTS.md",
      "sha256": "0000000000000000000000000000000000000000000000000000000000000000",
      "role": "dispatch",
      "mode": "created"
    }
  ],
  "skills": [
    {
      "name": "framing",
      "source_path": ".eidolons/forge/skills/framing.md",
      "source_sha256": "0000000000000000000000000000000000000000000000000000000000000000",
      "vendor_path": ".claude/skills/forge-framing/SKILL.md",
      "vendor_sha256": "0000000000000000000000000000000000000000000000000000000000000000"
    },
    {
      "name": "deliberation",
      "source_path": ".eidolons/forge/skills/deliberation.md",
      "source_sha256": "0000000000000000000000000000000000000000000000000000000000000000",
      "vendor_path": ".claude/skills/forge-deliberation/SKILL.md",
      "vendor_sha256": "0000000000000000000000000000000000000000000000000000000000000000"
    },
    {
      "name": "verification",
      "source_path": ".eidolons/forge/skills/verification.md",
      "source_sha256": "0000000000000000000000000000000000000000000000000000000000000000",
      "vendor_path": ".claude/skills/forge-verification/SKILL.md",
      "vendor_sha256": "0000000000000000000000000000000000000000000000000000000000000000"
    }
  ],
  "token_budget": {
    "entry": 765,
    "working_set_target": 1000
  },
  "security": {
    "reads_repo": false,
    "reads_network": false,
    "writes_repo": false,
    "persists": []
  }
}
